"title","company","location","link"
"Business / Data Analyst","Kforce Technology Staffing","Remote or Quincy, Massachusetts","https://www.dice.com/job-detail/f07eb3fd-8247-43a1-a08d-121dfc9ab24f"
"Sr. Data Analyst","Apex Systems","Quincy, Massachusetts","https://www.dice.com/job-detail/46d0bfe6-2b40-40e3-aa3c-7ec60a06c641"
"Data Analyst","Software Guidance & Assistance","Boston, Massachusetts","https://www.dice.com/job-detail/02a19983-5c7a-48e0-ad15-5b0fd4d31a54"
"Senior Technical Data Analyst","Kforce Technology Staffing","Boston, Massachusetts","https://www.dice.com/job-detail/028043c6-6360-45e0-9502-9c98c552ed68"
"Sr. Data Analyst","ASK IT Solutions LLC","Hybrid in Boston, Massachusetts","https://www.dice.com/job-detail/461a1dfe-6769-4b00-baca-3bbf56d827c8"
"Data Analyst - Need Bank / Financial client exp","Zealogics","Boston, Massachusetts","https://www.dice.com/job-detail/264cca1e-1677-472e-810f-3e450ede44df"
"Data Analyst","Motion Recruitment Partners, LLC","Boston, Massachusetts","https://www.dice.com/job-detail/72855b28-0bbb-4e9b-b917-a92e8c37d6e2"
"Data analyst with Pharam Background","Net2Source Inc.","Boston, Massachusetts","https://www.dice.com/job-detail/8160a0eb-a32a-407f-89ad-0c7b05695fc3"
"Senior Business Analyst/Data Analyst","MARKS IT SOLUTIONS LLC","Hybrid in Boston, Massachusetts","https://www.dice.com/job-detail/8e7f4792-2baf-40a4-bb71-97c04442afbd"
"Reference data data Analyst with CRM integration- Reference data must with CRM- no corps","Yoh - A Day & Zimmerman Company","Remote or Boston, Massachusetts","https://www.dice.com/job-detail/2027fdd4-808f-402f-a9e4-c7e8ca66e083"
"Reference data data Analyst with CRM integration- Reference data must with CRM- no corps","Yoh - A Day & Zimmerman Company","Remote or Boston, Massachusetts","https://www.dice.com/job-detail/75078ebf-1282-49b3-9fd8-c50f9c78a1a1"
"Sr. Data Analyst","Edify Technologies, Inc.","Remote","https://www.dice.com/job-detail/1440ab57-2192-4b18-8f98-1337b9ed714b"
"Data Analyst","Advansys Inc","Remote","https://www.dice.com/job-detail/4d0ab0c2-ee83-4e6a-9bc8-d5e34782d3b7"
"Jr. Data Analyst","Brezo Business Solutions LLP","Remote","https://www.dice.com/job-detail/4ac584f4-e004-457a-8e8c-5f251d1ef118"
"Enterprise Reference Data Analyst, CO-OP","State Street Corporation","Quincy, Massachusetts","https://www.dice.com/job-detail/2f719ab4-5972-4973-910e-79ae624cff4c"
"Data Analyst - Corporate Technology Data Engineering & Analytics","Mass Mutual Financial Group","Remote or Boston, Massachusetts","https://www.dice.com/job-detail/5a90f42f-f169-4584-ae0e-2c82ad46cdbc"
"Enterprise Reference Data Analyst, CO-OP","State Street Corporation","Quincy, Massachusetts","https://www.dice.com/job-detail/44b06f96-295c-4079-af4f-75d18379e3f6"
"Senior Data Analyst, CSR & Sustainability","CVS Health","Remote or Woonsocket, Rhode Island","https://www.dice.com/job-detail/cfe369a7-8352-453b-842a-2d01b64c7f71"
"Data Governance Analyst, CO-OP","State Street Corporation","Quincy, Massachusetts","https://www.dice.com/job-detail/a861bc22-04b2-42e6-97ff-488edf6fa6b4"
"Data Governance Analyst, CO-OP","State Street Corporation","Quincy, Massachusetts","https://www.dice.com/job-detail/0acf96c9-5f73-4db9-b44d-91323d83acdf"
"Pharmacy Benefit Management (PBM) Data Analyst","KE Staffing","Remote","https://www.dice.com/job-detail/34280def-df10-4eae-9834-241a112efcca"
"Data Analyst","Dexter Technologies","Remote","https://www.dice.com/job-detail/0efe82ba-de45-4162-967f-8796eef81978"
"Data Analyst","Advanced Software Talent","Remote or Hybrid in South San Francisco, California","https://www.dice.com/job-detail/3af9dffb-9b35-4058-8a1e-e89bac63dd86"
"Data Analyst Developer","AaraTechnologies Inc","Remote or Hybrid in Texas City, Texas","https://www.dice.com/job-detail/7aa6f164-b5cc-45bd-b7eb-0897828a120b"
"Data Analyst Developer","AaraTechnologies Inc","Remote or Hybrid in Missouri City, Texas","https://www.dice.com/job-detail/54a87045-23a4-4e51-89fc-f5553d7b480e"
"Salesforce Data Analyst","Kforce Technology Staffing","Remote or Frisco, Texas","https://www.dice.com/job-detail/04206221-e578-404f-ba97-01f4daa77756"
"Lead Data Analyst","Robert Half","Remote or Sherman, Illinois","https://www.dice.com/job-detail/fb85845e-8f01-41b7-a76f-5f39f687eebe"
"Senior Data Analyst","Skillify Solutions","Remote","https://www.dice.com/job-detail/9f756350-ec0a-4918-bc47-d1147c361ece"
"Data Analyst - PMO","Cushman & Wakefield","Remote","https://www.dice.com/job-detail/20727f96-8990-438b-9201-1d3deab3953a"
"Supply Chain Data Analyst","ConsultNet, LLC","Remote","https://www.dice.com/job-detail/7c53a969-0f03-4a33-a927-d4e572686dd0"
"Supply Chain Data Analyst","ConsultNet, LLC","Remote","https://www.dice.com/job-detail/74f6b940-cd0f-4d1c-bbdc-3f7bb5bec49f"
"Senior Data Analyst","Molina Healthcare","Remote or Long Beach, California","https://www.dice.com/job-detail/af140be9-8474-4feb-8756-3e54bfeb4e07"
"Senior, Data Analyst","Walmart Inc.","Remote or Bentonville, Arkansas","https://www.dice.com/job-detail/f57c1669-3741-4ba4-aa90-9803d38fcf10"
"Data Analyst - Compliance","Guardian Life Insurance Company","Remote or Bethlehem, Pennsylvania","https://www.dice.com/job-detail/ce7d1411-45e0-4838-96c0-fce729cc96a1"
"Data Analyst EPIC Systems","Javen Technologies, Inc","Remote or Hybrid in Eagan, Minnesota","https://www.dice.com/job-detail/d81ff67b-cc3a-4bec-b6dd-ec3eba2f21cb"
"Data Analyst - Supply Chain","Cardinal Health","Remote or Ohio","https://www.dice.com/job-detail/8ac86e98-62f7-4671-9be4-4f3efca5e91b"
"Finance Data Analyst","Sincera Technologies, Inc.","Remote","https://www.dice.com/job-detail/fbce1ae1-9cb0-4ec6-bdee-d85beec6e309"
"Data Analyst II","Katalyst Healthcares and Lifesciences","Remote or New York","https://www.dice.com/job-detail/ec73d1d1-b69b-4d71-85e2-d6935b736e4b"
"Data Analyst 2 - Officer","Citi","Remote or Tampa, Florida","https://www.dice.com/job-detail/3ae7fbf2-b83d-42ed-b674-a91cf308258b"
"Business/Data Analyst","Vaco by Highspring","Remote","https://www.dice.com/job-detail/e12784f3-002c-4d3b-be17-cbe2c1218c2c"
"Assessment Data Analyst","GDH","Remote","https://www.dice.com/job-detail/bcf1036f-b2af-477d-a9b1-68a4a02df478"
"Data Analyst II","U.S. Tech Solutions Inc.","Remote","https://www.dice.com/job-detail/67be5f17-017b-4dcb-8e2e-ee56a4026ae9"
"Data Analyst and Engineer","Ohm Systems, Inc","Remote or Lakewood, Colorado","https://www.dice.com/job-detail/f044b763-0768-4501-a78e-6dd3a7d8f802"
"Data Analyst","Gov Services Hub","Remote or McLean, Virginia","https://www.dice.com/job-detail/411a17f7-d265-4153-9933-d95c38039de4"
"Data Analyst (Health Plan)","Genzeon","Remote","https://www.dice.com/job-detail/39a4d1d6-0aa8-4f30-8e63-976b79c9bcc4"
"Data Analyst","OSI Engineering, Inc.","Remote","https://www.dice.com/job-detail/22197052-eb46-4e55-a5bb-74c997afa78c"
"Sr. Associate Data Analyst","McKesson Corporation","Remote or Alpharetta, Georgia","https://www.dice.com/job-detail/31340dcf-d267-45f0-b616-aad37b0d7998"
"Data Analyst","Eliassen Group","Remote or Almont, Colorado","https://www.dice.com/job-detail/e0d306cc-5042-4d2a-a311-7ab3cb6f5d50"
"Remote Data Analyst - W2 Consultant","Irvine Technology Corporation (ITC)","Remote or Kissimmee, Florida","https://www.dice.com/job-detail/4270ea9f-bcd3-4add-b0ab-ec1047ce3549"
"Senior Fraud Data Analyst","Rippling","Remote or New York, New York","https://www.dice.com/job-detail/652a61a7-d0d8-419a-86c3-4e887818b14e"
"Systems and Data Analyst","Boeing Company","Remote or Swansea, Illinois","https://www.dice.com/job-detail/806147ce-9cb3-4165-b84e-762f947b615c"
"Data Analyst - Intel Pipeline","ConsultNet, LLC","Remote or Minneapolis, Minnesota","https://www.dice.com/job-detail/e053b2bc-af93-4b9a-9036-a0121d6a4030"
"Senior Data Analyst, Regulatory","Block Inc","Remote or California","https://www.dice.com/job-detail/a16e8b59-715d-4667-ba24-3a3916bb4f52"
"Senior Data Analyst, Regulatory","Block Inc","Remote or New York, New York","https://www.dice.com/job-detail/aa5a60b6-00b1-41f9-a899-c59c22b33e6c"
"Sr. Enterprise Data Analyst","Under Armour","Remote or Oregon","https://www.dice.com/job-detail/b4be953d-66a8-4119-ab5a-0939869b57fd"
"Senior Clinical Data Analyst","Ascension Health","Remote","https://www.dice.com/job-detail/0ca07723-08f5-43a4-a505-09137483b557"
"Senior Data Analyst - (Remote - US)","ICF","Remote or Reston, Virginia","https://www.dice.com/job-detail/d6a86fd4-3d90-423c-81fa-0acdbccbf922"
"Data Analyst, GTM Analytics","Stripe","Remote or Toronto, Ontario","https://www.dice.com/job-detail/3666caae-903b-4ce4-b4f2-58c76c4a222c"
"Business Unit Data Analyst","City National Bank","Remote or Los Angeles, California","https://www.dice.com/job-detail/858e6fb0-166e-4a9d-935f-d7a2afe44acb"
"Maximo Data Analyst","ComTec Information Systems","Remote or Hybrid in Houston, Texas","https://www.dice.com/job-detail/fc0bb932-7fb1-4de6-bc04-2a1f22195244"
"Lead Data Analyst","Reliable Software Resources","Remote","https://www.dice.com/job-detail/2ac37914-540e-467e-a517-9e26f8645ef5"
"Healthcare Analytics Data Analyst II",,"Remote or Missouri","https://www.dice.com/job-detail/898aebb8-b8c1-4685-ba2b-e84109159ddc"
"Healthcare Data Analyst","APN Consulting Inc","Remote or Hybrid","https://www.dice.com/job-detail/918fcb06-bb8a-4d33-bd32-d36cde27bc53"
"Data Analyst 3 - Supplier Operations - HYBRID","Nordstrom","Remote or Seattle, Washington","https://www.dice.com/job-detail/7a602701-7adc-491e-85f7-a8051c3ccb10"
"Data Analyst, Clinical Analytics and Reporting","DaVita Inc.","Remote or Denver, Nova Scotia","https://www.dice.com/job-detail/2bac3b89-a981-4edd-ac6b-592f3ced6f0e"
"Data Analyst II Healthcare Analytics",,"Remote or Missouri","https://www.dice.com/job-detail/0e232a64-38bc-4cbe-9d06-daf66489efff"
"Data Analyst 2 - Inventory Optimization - HYBRID","Nordstrom","Remote or Seattle, Washington","https://www.dice.com/job-detail/8ef5d1ef-a496-4604-aea7-04292d5e076f"
"Revenue Cycle Data Analyst - Ambulatory Billing","Ascension Health","Remote","https://www.dice.com/job-detail/4e63cf10-7127-496b-ac1a-fc1a8506cf77"
"Motility Data Analyst","The Reynolds and Reynolds Company","Remote or Dayton, Ohio","https://www.dice.com/job-detail/820c63f6-1644-4c5e-bc8e-9a2182510a4d"
"Sr. Data Analyst, Revenue Assurance","Comcast Corp","Remote or Atlanta, Georgia","https://www.dice.com/job-detail/d60e164e-b541-4a17-81e3-91171d03d0d2"
"Lead Data Analyst (Frisco, TX)","Thomson Reuters U.S. Inc.","Remote or Frisco, Texas","https://www.dice.com/job-detail/42a1524b-d1df-4047-a1a8-d01b09863756"
"Data Analyst (Medicaid Claims and Encounter Data)","Cloud and Things","Remote or Albany, New York","https://www.dice.com/job-detail/9df6b0b3-90b5-451c-9654-2856efe79ec2"
"Senior System and Data Analyst","Boeing Company","Remote or Kent, Washington","https://www.dice.com/job-detail/401330ce-fb8e-4a3f-a62f-4d76e9f44345"
"Information Security Lead Data Analyst Vice President","Citi","Remote or Irving, Texas","https://www.dice.com/job-detail/5a36f45c-8063-44b3-8668-7573f29f703b"
"Data Analyst I First Line of Defense","City National Bank","Remote or Los Angeles, California","https://www.dice.com/job-detail/b1551e61-c625-46b0-bedc-70bf1d812fa7"
"Sr. Data Analyst-PMO","Cushman & Wakefield","Remote","https://www.dice.com/job-detail/867a6a58-0b3f-4fd8-bbfd-af90678c4d9c"
"Senior Healthcare Data Analyst","Cloud and Things","Remote or Albany, New York","https://www.dice.com/job-detail/ce25a617-a895-430f-b014-b97fd5f9746c"
"Data Analyst Intern - 2026 Summer Internship (Chicago Hybrid)","Motorola Solutions","Remote or Chicago, Illinois","https://www.dice.com/job-detail/e67da4be-e18c-43e3-b3a8-b2b85e65c089"
"Data Analyst, Environmental, Occupational, and Dietary Risks (Temporary)","University of Washington","Remote or Washington","https://www.dice.com/job-detail/be62900f-09f6-4403-8dc5-9e2e27b4b5b6"
"Data Analyst, CAR-T Commercial Operations & Analytics","Johnson & Johnson","Remote or Horsham, Pennsylvania","https://www.dice.com/job-detail/9a08584e-1263-4aa1-9276-108c1150670c"
"DATA ANALYST -BANKING, CREDIT CARDS","Infini-Tek","Remote","https://www.dice.com/job-detail/423b6b9c-101b-49cb-a69b-cf4f73eaf941"
"Senior Systems and Data Analyst","Boeing Company","Remote or Hazelwood, Missouri","https://www.dice.com/job-detail/29857f3b-992c-4eb6-92b2-c91ec6caf7b7"
"Senior Data Analyst, Stores & Finance (Hybrid, Seattle)","Nordstrom","Remote or Seattle, Washington","https://www.dice.com/job-detail/4aafb1fc-19fa-41a9-9d67-cd5b64166587"
"Data Analyst Cum Data Engineer w2","SoftCorp International, Inc.","Remote or Hybrid in Johnston, Iowa","https://www.dice.com/job-detail/9f4eae81-114c-46b7-94f7-d6cd8a3aee7a"
"Geospatial Data Analyst for Wildfire-Fuel Treatment Outcomes (Temporary)","University of Washington","Remote or Seattle, Washington","https://www.dice.com/job-detail/0168b54d-6e04-41b8-bd2f-5483c79bdaae"
"Senior SQL Data Analyst - Billing / Law (REMOTE)","Techstra Solutions","Remote","https://www.dice.com/job-detail/17e383b3-1e29-44fe-807e-a2ae4014c2ee"
"Nuclear Field Services Data Analyst - In-Vessel UT (Remote Eligible, U.S.)","GE Vernova","Remote","https://www.dice.com/job-detail/450334e1-cc6d-495e-9443-39d7b9e20ff8"
"SeniorAlteryx Data Analyst w/ SAP S4 GL Fixed Assets","Nexxora Inc.","Remote","https://www.dice.com/job-detail/23cf182f-cef7-4f96-8087-64dcbc8c21d0"
"Jr. Data Analyst (remote)","Software Guidance & Assistance","Remote or Hartford, Connecticut","https://www.dice.com/job-detail/aeb440d2-e6d9-4482-953a-bd86ee9f29de"
"Data Analyst Credit Portfolio III","City National Bank","Remote or PT CHARLOTTE, Florida","https://www.dice.com/job-detail/67ea4923-201a-40c9-9b41-7c9395a5a6d7"
"Alpha Data Services Business Control Analyst - AVP","State Street Corporation","Boston, Massachusetts","https://www.dice.com/job-detail/88875e20-5ad4-486f-b15c-c0b1226700f9"
"Alpha Data Services Business Control Analyst - AVP","State Street Corporation","Boston, Massachusetts","https://www.dice.com/job-detail/e216694e-61f6-46c4-9ff6-f12fdfd53793"
"Assistant Vice President, ICM CCR Data Analyst","Citi","Remote or Tampa, Florida","https://www.dice.com/job-detail/40b63197-5d63-444f-bfed-d87507a7a66e"
"Alpha Data Services Business Software Analyst - Vice President","State Street Corporation","Boston, Massachusetts","https://www.dice.com/job-detail/97bc6e32-31b9-4796-910f-09adcf2ac03b"
"Alpha Data Services Business Software Analyst - Vice President","State Street Corporation","Boston, Massachusetts","https://www.dice.com/job-detail/77ad3e55-6105-453f-bc45-f4dddcd6e1a5"
"Customer Data Management Analyst","Guardian Life Insurance Company","Remote or New York, New York","https://www.dice.com/job-detail/c844d460-2ab7-4440-a3a7-283c07d83c2c"
"HSG Data Analytics Sr Analyst","DaVita Inc.","Remote or Denver, Colorado","https://www.dice.com/job-detail/55a82b22-c5a5-4c7b-bc2f-52c96262e83e"
"Data Governance Analyst","Robert Half","Remote or Cincinnati, Ohio","https://www.dice.com/job-detail/35cb9d7b-3cf0-412a-8813-fe88df116990"
"Data Engineer - Database Analyst/Programmer - Senior","Arch Systems, LLC","Remote","https://www.dice.com/job-detail/f70b02bf-2b6f-40a5-b46c-cdac8cf9e6f9"
"Data Governance Analyst/Trainer","EmployVision","Remote","https://www.dice.com/job-detail/64e2d053-fa41-45f1-8cd2-bf502cbfe3c1"
"Data and Analytics Analyst III","ConsultNet, LLC","Remote or Hybrid in Hoover, Alabama","https://www.dice.com/job-detail/d4362fac-ab6c-4836-b9d5-b06fec626774"
"Data Governance Analyst Assistant Vice President","Citi","Remote or Tampa, Florida","https://www.dice.com/job-detail/1e12def9-a625-45fd-8859-68626481cad9"
"Data Quality Lead Analyst Vice President","Citi","Remote or Irving, Texas","https://www.dice.com/job-detail/60e2db37-a733-4b07-848c-204c87db2707"
"Senior Engineer (Sr. Data Security Analyst)","College Board","Remote","https://www.dice.com/job-detail/fdd045fb-ea92-4c80-9ecd-c59cec5f5382"
"Data Governance Analyst","Ohm Systems, Inc","Remote or Lakewood, Colorado","https://www.dice.com/job-detail/5a05a570-0199-4cc6-82c2-bd820ca1a2a2"
"Data Quality Senior Analyst","Citi","Remote or Irving, Texas","https://www.dice.com/job-detail/e6d9c129-1cc7-428d-9e5e-767bf7dd6038"
"Data Quality Lead Analyst","Citi","Remote or Jacksonville, Florida","https://www.dice.com/job-detail/b6aa782b-466f-428c-8d83-068a44a1faa3"
"Salesforce Data Visualization Analyst (Tableau)","HigherEchelon","Remote","https://www.dice.com/job-detail/f80cffd1-7575-46fb-8453-0362e3692ed1"
"Data Governance Lead Analyst Hybrid","Citi","Remote or New Castle, Delaware","https://www.dice.com/job-detail/bd64697e-1cb5-41b0-978e-47a395881a08"
"Data Privacy / Protection Analyst (Cyber)","Dexian Signature Consultants","Remote","https://www.dice.com/job-detail/777f6787-0607-4aee-8ad4-22c9766186c3"
"AVP, Data Quality Sr Analyst (Hybrid)","Citi","Remote or University at Buffalo, New York","https://www.dice.com/job-detail/5f189291-ed4e-46ca-b7b6-4e52d526f101"
"Lead Analyst, Data - (Medicare Stars- Remote)","Molina Healthcare","Remote or Long Beach, California","https://www.dice.com/job-detail/2d06b816-9af5-4c75-b650-bcb77d9e602d"
"Lead Data Governance Analyst","Citi","Remote or New York, New York","https://www.dice.com/job-detail/e8e80cc3-4779-4263-a4a0-4f797c26cdfa"
"Data Governance Senior Analyst Assistant Vice President","Citi","Remote or Tampa, Florida","https://www.dice.com/job-detail/2db1961e-eb1c-440b-8474-236fd1b443fd"
"Senior Analyst, Data Management","DaVita Inc.","Remote or Federal Way, Washington","https://www.dice.com/job-detail/9d0becff-3b14-4113-af0c-e7bc4b8a0918"
"Lead Data Governance Analyst","Citi","Remote or Tampa, Florida","https://www.dice.com/job-detail/0445f6fd-a8f9-444d-9455-45b80ea51c3e"
"Senior Data Privacy Analyst - REMOTE","Westinghouse Electric Company LLC","Remote or North Carolina","https://www.dice.com/job-detail/2a57ab88-0ae6-44a8-ac7b-b90bd6ec992e"
"Data Analyst II Medical Economics",,"Remote or Florida","https://www.dice.com/job-detail/eaec368a-1850-4b04-b108-3e0c64481ea0"
"Data Architect- Lead Analyst - VP","Citi","Remote or New Castle, Delaware","https://www.dice.com/job-detail/bda39dfa-b214-4d8a-8e21-2a22a678d807"
"Collateral Data Quality Senior Analyst AVP","Citi","Remote or Tampa, Florida","https://www.dice.com/job-detail/1b2faaac-6f74-44e4-9f2c-bfbb2dec3774"
"Analyst, Data Management (ROPS)","DaVita Inc.","Remote or California","https://www.dice.com/job-detail/ff236119-cb0b-421c-9140-533eff5a310d"
"Analyst, Data Management (ROPS)","DaVita Inc.","Remote or Denver, Colorado","https://www.dice.com/job-detail/1ce0591b-3778-4ba3-a220-18e83bdcc63a"
"25887819 Data Quality Sr Analyst, AVP - Jacksonville (Hybrid)","Citi","Remote or Jacksonville, Florida","https://www.dice.com/job-detail/ed1bd007-8f15-45d2-8903-fd08d5849bf5"
"Data Manager Analytics / Data Analyst Manager / Data Architect","IT Trailblazers, LLC","Remote","https://www.dice.com/job-detail/75270642-8907-47a2-9904-3d26a828a774"
"Senior Data Interoperability Analyst","Ascension Health","Remote","https://www.dice.com/job-detail/c16fd1f4-1fb2-4dbb-920a-b393eedd6eff"
"Data Operations Analyst","Trans Union LLC","Remote","https://www.dice.com/job-detail/a6764335-25b7-4883-a99a-ea157a1d577e"
"Senior Data and Reporting Analyst Program Management Capabilities","Citi","Remote or Tampa, Florida","https://www.dice.com/job-detail/1e90bf72-97c5-493d-b099-f64f49c2ba31"
"Data Analytics Lead Analyst - VP - TAMPA","Citi","Remote or Tampa, Florida","https://www.dice.com/job-detail/a31b3951-47d7-4893-94a5-b4cde9f42f19"
"Vice President, Data Quality Lead Analyst - C13 - TAMPA","Citi","Remote or Tampa, Florida","https://www.dice.com/job-detail/aab1b9b4-88ef-44d6-a744-e0e668a26354"
"Data Architecture Lead Analyst - Vice President","Citi","Remote or Rutherford, New Jersey","https://www.dice.com/job-detail/b49c10cf-ebf1-4d36-b41c-55062155ce94"
"Data Analyst II - SQL",,"Remote or Missouri","https://www.dice.com/job-detail/3f65ef00-e654-408f-9da1-5ebc2ec5c527"
"Data Analytics Senior Lead Analyst, SVP, Irving","Citi","Remote or Irving, Texas","https://www.dice.com/job-detail/754a428f-0dbc-47cd-a41b-79d32ac3d812"
"Data Concern Central Intake Analyst","Citi","Remote or Tampa, Florida","https://www.dice.com/job-detail/879722a0-b347-4115-910d-91211304037a"
"Data Quality Controls Lead Analyst - Vice President","Citi","Remote or Tampa, Florida","https://www.dice.com/job-detail/46f7746a-b0e3-439b-bac2-3a5a54c5e543"
"Wholesale Lending and Enterprise Data - Data Governance Foundation Senior Analyst - Vice President","Citi","Remote or Tampa, Florida","https://www.dice.com/job-detail/a529b9cd-97f8-45dd-adfc-880f811cacc3"
"Data Integration Senior Lead Analyst Senior Vice President","Citi","Remote or New York, New York","https://www.dice.com/job-detail/8e059dff-769d-4ebd-93bd-45e35e9d5424"
"Sr. Analyst - Horizontal Data","Ascension Health","Remote","https://www.dice.com/job-detail/851e1eff-f4c7-4e46-8ac7-8187bbd7540a"
"VP, Data Governance Foundation Lead Analyst","Citi","Remote or New York, New York","https://www.dice.com/job-detail/080cbc07-3968-4ef6-97f0-43a38890e0df"
"Data Risk and Control Lead Analyst - VP","Citi","Remote or Tampa, Florida","https://www.dice.com/job-detail/db286b72-fdc9-404f-bd3a-5fba23a670ad"
"Data Governance Foundation Sr. Analyst - AVP","Citi","Remote or Tampa, Florida","https://www.dice.com/job-detail/4aa41ec4-2ded-4aef-8469-7b8a12d8fa2b"
"Data Governance Foundation Lead Analyst - VP","Citi","Remote or Irving, Texas","https://www.dice.com/job-detail/f58c3f5a-6f1c-42e4-8b66-af1a6c91b178"
"Data Governance Foundation Lead Analyst - VP","Citi","Remote or Tampa, Florida","https://www.dice.com/job-detail/2bc469f6-a65c-4aef-941c-c245bacd4ad5"
"Data Governance Foundation Senior Analyst Assistant Vice President","Citi","Remote or Tampa, Florida","https://www.dice.com/job-detail/3b112daf-9e91-4625-b032-af2f19f92521"
"Data Governance Technology Lead Analyst Vice President","Citi","Remote or Tampa, Florida","https://www.dice.com/job-detail/2afcb9a5-cf7a-4d5d-9a80-1eea241a19b3"
"Data Concern Remediation Management Senior Lead Analyst - Senior Vice President","Citi","Remote or New York, New York","https://www.dice.com/job-detail/562dfe71-7323-41ec-8ad1-36ac86536872"
"Data Governance Foundational Lead Analyst VP","Citi","Remote or Tampa, Florida","https://www.dice.com/job-detail/9314ee74-e864-4406-9c15-32a6badbac4b"
"Sr. Data & BI Lead Analyst, VP","Citi","Remote or Irving, Texas","https://www.dice.com/job-detail/0ecb63bc-bddd-4af1-9afc-fda15d5c074e"
"Data Governance Foundation Senior Lead Analyst","Citi","Remote or Tampa, Florida","https://www.dice.com/job-detail/282ee9d2-5dd2-4c03-b9f1-0cc1d64737c5"
"Outcomes Reporting Analyst","Phoenix Technology Partners, LLC","Remote","https://www.dice.com/job-detail/83a7d078-9fa1-4d2f-b53d-5ad2a8509f0c"
"Data Governance Foundation Lead Analyst","Citi","Remote or Tampa, Florida","https://www.dice.com/job-detail/28b5bfc5-4abb-48e6-a09f-0dc78a7a4e9d"
"Workday Consultant","P2PSoftTek Inc","Remote","https://www.dice.com/job-detail/24dd70c1-254a-4cdc-9b95-0788bf3335a7"
"Enterprise Data Office Business Execution Lead Analyst","Citi","Remote or Irving, Texas","https://www.dice.com/job-detail/45985731-40de-4ddb-a5de-a56368994332"
"Analyst, Clinical Data Management, Clinical Informatics","CVS Health","Remote or Massachusetts","https://www.dice.com/job-detail/7436dbe1-14c5-4004-b473-186a59f27351"
"Sr BI Marketing Analyst: Remote","Vrddhi Solutions LLC","Remote","https://www.dice.com/job-detail/e9cd9985-c567-4b0e-a05d-f48a849579e6"
"Data Governance Foundation Sr Lead Analyst, SVP - New York (Hybrid)","Citi","Remote or New York, New York","https://www.dice.com/job-detail/d8eda160-ef15-4513-a85d-dfa62534b638"
"Senior Business Analyst","Aditi Consulting","Remote or Hybrid in Arlington Heights, Illinois","https://www.dice.com/job-detail/370c9eb8-fcdf-448b-b755-73e98526a210"
"Data Specialist","Dale Workforce Solutions","Remote or Hybrid in Durham, North Carolina","https://www.dice.com/job-detail/bc486546-0a94-4be2-96b0-5680254033e5"
"Sr. Analyst - Data Delivery and Governance Pipeline","Ascension Health","Remote","https://www.dice.com/job-detail/c2d50e08-8c27-44cd-b75f-ca1a433a09c0"
"Services Data Governance Foundation Lead Analyst - VP -","Citi","Remote or New York, New York","https://www.dice.com/job-detail/30709e27-a3ac-48b5-bd91-e023646554af"
"Data Analyst IV Medical Economics",,"Remote or Michigan","https://www.dice.com/job-detail/7cc52040-f5b6-476f-b339-4628f7f4ce47"
"Data Analyst III Medical Economics",,"Remote or Missouri","https://www.dice.com/job-detail/c39bc626-68d0-4947-a811-722a86e56e60"
"Data Governance Foundation Lead Analyst - Vice President","Citi","Remote or Tampa, Florida","https://www.dice.com/job-detail/ce0cb1f2-d776-4325-91a5-8941e82003e4"
"Business Systems Analyst - Corporate Technology Data Engineering & Analytics","MassMutual","Boston, Massachusetts","https://www.dice.com/job-detail/bc4094f3-5adc-4f7d-943f-a72ea69cbf89"
"Marketing Analytics Consultant","MassMutual","Boston, Massachusetts","https://www.dice.com/apply-redirect?applyData=eyJjb25maWd1cmVkVXJsIjoiaHR0cHM6Ly9kc3AucHJuZy5jby8ydXlYNjNiIiwiam9iSWQiOiIzZTQ2OThkZC1kMjJkLTQyNGMtOWIzMi1kNDljYzY3ZTQ4ZTEiLCJqb2JUaXRsZSI6Ik1hcmtldGluZyBBbmFseXRpY3MgQ29uc3VsdGFudCIsImpvYlR5cGUiOiJwcm9ncmFtbWF0aWMifQ=="
"IT Business Analyst - Data & Regulatory Reporting, CO-OP","State Street Corporation","Quincy, Massachusetts","https://www.dice.com/job-detail/235d95f7-d2ee-4ff9-bf82-2090a53dbb78"
"SAP P2S (Plan to Supply) Data Consultant","radient.ai","Remote","https://www.dice.com/job-detail/a24a01b8-1c40-415d-8a8f-a96e786b5412"
"SAP S2P (Source to Pay) Data Consultant","GG Tech Global","Remote","https://www.dice.com/job-detail/725d152f-ebb1-44be-b7bb-2fd9b80666f2"
"Data Analytics Consultant","Allstate Insurance Company","Remote or North Carolina","https://www.dice.com/job-detail/e5839f07-014d-4878-8f5a-165c63ebc6d5"
"Data Analytics Developer","Dropbox Inc","Remote","https://www.dice.com/job-detail/2b71ef99-31cc-4df3-9901-aa02b3804557"
